{"schema":"epistates/task-card/v1","task_id":"e4-opencode-port","objective":"Implementar un puerto E4 mínimo para la API pública HTTP de OpenCode, configurado para un agente GLM de Z.ai, sin iniciar servidor ni ejecutar wake real.","target":{"repository":"epistates","base_sha":"d96cd4cd8c3d6868e838c2f060f4736432bb9853","branch":"main","worktree":"/Users/krisnova/www/aria/epistates"},"role":"developer","authority":{"grant_id":"maintainer-e4-opencode-port","granted_by":"maintainer","granted_actions":["read","edit","run_checks"],"protected_operations_authorized":[]},"allowed_paths":["src/epistates/opencode_wake.py","tests/test_opencode_wake.py","docs/architecture/0008-opencode-wake-port.md","docs/architecture/README.md","docs/plans/2026-08-28-e4-reactivation-design.md","docs/plans/2026-08-28-e4-opencode-port.task-card.json","docs/adversarial-e4-opencode-port.md"],"allowed_actions":["read","edit","run_checks"],"forbidden_operations":["commit","push","open_pr","merge","release","install_dependencies","change_scope","git_reset","create_branch","delete_branch","create_worktree","remove_worktree"],"inputs":["docs/architecture/0007-reactivacion-soportada.md","docs/threat-model-e4-reactivation.md","docs/adversarial-e4-wake-guard.md"],"checks":[{"check_id":"diff_check","expected":"exit 0"},{"check_id":"unit_tests","expected":"exit 0"}],"evidence":{"report_format":"rag/v1","required":["worktree_status","diff_check","check_results"]},"delivery":"Puerto OpenCode con allowlist, pruebas simuladas y dictamen adversarial; detenerse sin servidor, credenciales, red real, Z.ai directo o wake real.","stop_condition":"Detenerse ante necesidad de iniciar OpenCode, obtener credenciales, consultar Z.ai, usar endpoints shell/config/MCP/TUI o enviar HTTP real.","new_decision_required_for":["activar servidor","credenciales","wake real","tráfico de red","cambio de agente o modelo","automatización de permisos","release"]}
