{"schema":"epistates/task-card/v1","task_id":"e3b-receipt-store","objective":"Implementar un store SQLite local de consumo único E3a y pruebas adversariales, sin watcher, red, CLI ni reactivación.","target":{"repository":"epistates","base_sha":"ad6fc6279571fa6c03dc2e0ce89a3a3c46200143","branch":"main","worktree":"/Users/krisnova/www/aria/epistates"},"role":"developer","authority":{"grant_id":"maintainer-e3b-receipt-store","granted_by":"maintainer","granted_actions":["read","edit","run_checks"],"protected_operations_authorized":[]},"allowed_paths":["src/epistates/signal_receipts.py","tests/test_signal_receipts.py","docs/plans/2026-08-28-e3-senal-local.md","docs/plans/2026-08-28-e3b-receipt-store.task-card.json"],"allowed_actions":["read","edit","run_checks"],"forbidden_operations":["commit","push","open_pr","merge","release","install_dependencies","change_scope","git_reset","create_branch","delete_branch","create_worktree","remove_worktree"],"inputs":["docs/plans/2026-08-28-e3a-receipt-design.md","docs/architecture/0004-senal-local-y-consumo-atomico.md","src/epistates/human_notice.py"],"checks":[{"check_id":"diff_check","expected":"exit 0"},{"check_id":"unit_tests","expected":"exit 0"}],"evidence":{"report_format":"rag/v1","required":["worktree_status","diff_check","check_results"]},"delivery":"Store SQLite y pruebas; detenerse sin watcher, CLI, red o reactivación.","stop_condition":"Detenerse ante necesidad de fuente de señal, API pública, dependencia, watcher, wake o mutación Git.","new_decision_required_for":["watcher","reactivación","CLI o schema público","red, credenciales o dependencias","operaciones Git protegidas"]}
