{
  "schema": "epistates/task-card/v1",
  "task_id": "e3a-receipt-design",
  "objective": "Proponer el contrato documental de recibo y consumo local E3a sin implementar schema, store, watcher ni runtime.",
  "target": {
    "repository": "epistates",
    "base_sha": "d32d9c08d9ea94559606300a906ab43a5330de26",
    "branch": "main",
    "worktree": "/Users/krisnova/www/aria/epistates"
  },
  "role": "documenter",
  "authority": {
    "grant_id": "maintainer-e3a-receipt-design",
    "granted_by": "maintainer",
    "granted_actions": ["read", "edit", "run_checks"],
    "protected_operations_authorized": []
  },
  "allowed_paths": ["docs/plans/README.md", "docs/plans/2026-08-28-e3-senal-local.md", "docs/plans/2026-08-28-e3a-receipt-design.md", "docs/plans/2026-08-28-e3a-receipt-design.task-card.json"],
  "allowed_actions": ["read", "edit", "run_checks"],
  "forbidden_operations": ["commit", "push", "open_pr", "merge", "release", "install_dependencies", "change_scope", "git_reset", "create_branch", "delete_branch", "create_worktree", "remove_worktree"],
  "inputs": ["README.md", "project-manifest.yaml", "docs/architecture/0004-senal-local-y-consumo-atomico.md", "docs/plans/2026-08-28-e3-senal-local.md", "src/epistates/human_notice.py", "src/epistates/review.py"],
  "checks": [
    {"check_id": "git_status", "expected": "only approved documentation paths are modified"},
    {"check_id": "diff_check", "expected": "exit 0"},
    {"check_id": "unit_tests", "expected": "exit 0"}
  ],
  "evidence": {
    "report_format": "rag/v1",
    "required": ["worktree_status", "diff_check", "check_results"]
  },
  "delivery": "Propuesta E3a, tarjeta validada y reporte RAG; detenerse sin runtime, schema, store ni operaciones Git.",
  "stop_condition": "Detenerse ante necesidad de elegir fuente, persistencia concreta, dependencia, red, credenciales, API pública, watcher o reactivación.",
  "new_decision_required_for": ["schema o API pública", "implementación de store o atomicidad", "fuente de señal", "watcher", "reactivación", "dependencias, red o credenciales", "operaciones Git protegidas"]
}
