{"schema":"epistates/task-card/v1","task_id":"e4-opencode-terminal-response","objective":"Obtener evidencia concluyente de una respuesta terminal GLM mediante OpenCode, corrigiendo el criterio de espera y manteniendo herramientas y wake bloqueados.","target":{"repository":"epistates","base_sha":"6198a19927bcb5c34db1d0b0f393af8794b706f4","branch":"main","worktree":"/Users/krisnova/www/aria/epistates"},"role":"qa","authority":{"grant_id":"maintainer-e4-opencode-terminal-response","granted_by":"maintainer","granted_actions":["read","edit","run_checks"],"protected_operations_authorized":[]},"allowed_paths":["docs/plans/2026-08-28-e4-opencode-terminal-response.task-card.json","docs/adversarial-e4-opencode-terminal-response.md"],"allowed_actions":["read","edit","run_checks"],"forbidden_operations":["commit","push","open_pr","merge","release","install_dependencies","change_scope","git_reset","create_branch","delete_branch","create_worktree","remove_worktree"],"inputs":["opencode.json","docs/adversarial-e4-opencode-second-prompt.md","docs/adversarial-e4-opencode-zai-diagnostic.md","docs/architecture/0008-opencode-wake-port.md"],"checks":[{"check_id":"git_status","expected":"exit 0; sólo artefactos E4 autorizados"},{"check_id":"diff_check","expected":"exit 0"},{"check_id":"unit_tests","expected":"exit 0"}],"evidence":{"report_format":"rag/v1","required":["worktree_status","diff_check","check_results"]},"delivery":"Hasta tres sesiones secuenciales, cada una efímera y con un único prompt fijo, observadas mediante GET /session/status y GET /session/:id/message hasta estado terminal, texto no vacío o error concluyente. Detener al primer resultado concluyente. Servidor loopback, contraseña aleatoria no persistida, herramientas deny y cleanup por intento; ningún recibo E3, WakeGuardStore, watcher o wake automático.","stop_condition":"Detenerse ante herramienta allow o ask, listener no loopback, proveedor zai no conectado, endpoint fuera de health/agent/provider/session/status/prompt_async/session/message/session/delete, más de tres prompts, credencial persistida, parte tool, cambio de árbol, respuesta terminal ambigua después de 180 s o error que requiera cambiar modelo, permisos o autenticación.","new_decision_required_for":["wake real o automático","uso de recibo E3 o WakeGuardStore","cambio de permisos, agente o modelo","credenciales persistentes","más de tres prompts","release"]}
