{
  "schema": "epistates/task-card/v1",
  "task_id": "e3a-receipt-contract",
  "objective": "Documentar y someter a revisión el contrato arquitectónico de E3a para recibos de señal locales, sin implementar runtime.",
  "target": {
    "repository": "epistates",
    "base_sha": "8d825bc50c745a676f1d416753a09df3d7be274d",
    "branch": "main",
    "worktree": "/Users/krisnova/www/aria/epistates"
  },
  "role": "documenter",
  "authority": {
    "grant_id": "maintainer-e3a-receipt-contract",
    "granted_by": "maintainer",
    "granted_actions": ["read", "edit", "run_checks"],
    "protected_operations_authorized": []
  },
  "allowed_paths": ["docs/architecture/README.md", "docs/architecture/0004-senal-local-y-consumo-atomico.md", "docs/plans/README.md", "docs/plans/2026-08-28-e3-senal-local.md", "docs/plans/2026-08-28-e3a-receipt-contract.task-card.json"],
  "allowed_actions": ["read", "edit", "run_checks"],
  "forbidden_operations": ["commit", "push", "open_pr", "merge", "release", "install_dependencies", "change_scope", "git_reset", "create_branch", "delete_branch", "create_worktree", "remove_worktree"],
  "inputs": ["README.md", "project-manifest.yaml", "docs/development-workflow.md", "src/epistates/human_notice.py"],
  "checks": [
    {"check_id": "git_status", "expected": "only approved documentation paths are modified"},
    {"check_id": "diff_check", "expected": "exit 0"},
    {"check_id": "unit_tests", "expected": "exit 0"}
  ],
  "evidence": {
    "report_format": "rag/v1",
    "required": ["worktree_status", "diff_check", "check_results"]
  },
  "delivery": "ADR-0004, plan EPI-E3-001, tarjeta validada y reporte RAG; detenerse sin runtime ni operaciones Git.",
  "stop_condition": "Detenerse ante necesidad de cambiar runtime, schemas, CLI, dependencias, fuentes de señal, credenciales o reactivación.",
  "new_decision_required_for": ["cualquier cambio de runtime o contrato publicado", "watcher o fuente de señal", "persistencia de recibos", "reactivación", "operaciones Git protegidas", "dependencias o credenciales"]
}
