{"schema":"epistates/task-card/v1","task_id":"e4-opencode-second-prompt","objective":"Ejecutar una única segunda inferencia GLM autorizada tras confirmar Z.ai conectado, observando una respuesta sin herramientas y sin wake.","target":{"repository":"epistates","base_sha":"6198a19927bcb5c34db1d0b0f393af8794b706f4","branch":"main","worktree":"/Users/krisnova/www/aria/epistates"},"role":"qa","authority":{"grant_id":"maintainer-e4-opencode-second-prompt","granted_by":"maintainer","granted_actions":["read","edit","run_checks"],"protected_operations_authorized":[]},"allowed_paths":["docs/plans/2026-08-28-e4-opencode-second-prompt.task-card.json","docs/adversarial-e4-opencode-second-prompt.md"],"allowed_actions":["read","edit","run_checks"],"forbidden_operations":["commit","push","open_pr","merge","release","install_dependencies","change_scope","git_reset","create_branch","delete_branch","create_worktree","remove_worktree"],"inputs":["opencode.json","docs/adversarial-e4-opencode-first-prompt.md","docs/adversarial-e4-opencode-zai-diagnostic.md","docs/architecture/0008-opencode-wake-port.md"],"checks":[{"check_id":"git_status","expected":"exit 0; sólo artefactos permitidos"},{"check_id":"diff_check","expected":"exit 0"},{"check_id":"unit_tests","expected":"exit 0"}],"evidence":{"report_format":"rag/v1","required":["worktree_status","diff_check","check_results"]},"delivery":"Una sola sesión efímera y un solo prompt de estado con Z.ai conectado, observados durante hasta 120 s; reporte adversarial con tipos de partes y resultado saneado. El servidor usa loopback y contraseña aleatoria no persistida. No participan recibos E3, WakeGuardStore, watcher ni automatización.","stop_condition":"Detenerse ante herramienta allow o ask, listener no loopback, proveedor zai no conectado, endpoint distinto de health/agent/provider/session/prompt_async/session/message/session/delete, más de un prompt_async, credencial persistida, timeout, parte tool o cambio de árbol fuera de los dos artefactos.","new_decision_required_for":["un tercer prompt","wake real o automático","uso de recibo E3 o WakeGuardStore","cambio de permisos o modelo","credenciales persistentes","commit","push","release"]}
