{"schema":"epistates/task-card/v1","task_id":"e4-opencode-zai-diagnostic","objective":"Diagnosticar la disponibilidad local de la configuración y autenticación de Z.ai en OpenCode, sin inferencia, prompt, sesión ni exposición de credenciales.","target":{"repository":"epistates","base_sha":"6198a19927bcb5c34db1d0b0f393af8794b706f4","branch":"main","worktree":"/Users/krisnova/www/aria/epistates"},"role":"qa","authority":{"grant_id":"maintainer-e4-opencode-zai-diagnostic","granted_by":"maintainer","granted_actions":["read","edit","run_checks"],"protected_operations_authorized":[]},"allowed_paths":["docs/plans/2026-08-28-e4-opencode-zai-diagnostic.task-card.json","docs/adversarial-e4-opencode-zai-diagnostic.md"],"allowed_actions":["read","edit","run_checks"],"forbidden_operations":["commit","push","open_pr","merge","release","install_dependencies","change_scope","git_reset","create_branch","delete_branch","create_worktree","remove_worktree"],"inputs":["opencode.json","docs/adversarial-e4-opencode-first-prompt.md","docs/architecture/0008-opencode-wake-port.md"],"checks":[{"check_id":"git_status","expected":"exit 0; sólo artefactos permitidos"},{"check_id":"diff_check","expected":"exit 0"},{"check_id":"unit_tests","expected":"exit 0"}],"evidence":{"report_format":"rag/v1","required":["worktree_status","diff_check","check_results"]},"delivery":"Un diagnóstico saneado de GET /global/health, GET /agent y GET /provider en un servidor OpenCode temporal, autenticado y ligado a loopback. Sólo se reportan presencia de proveedor, modelo y pertenencia de zai a connected; nunca secretos ni métodos de autenticación detallados.","stop_condition":"Detenerse ante prompt, creación de sesión, endpoint de escritura, autenticación OAuth, salida que contenga una clave, listener no loopback, credencial persistida o endpoint distinto de health/agent/provider.","new_decision_required_for":["prompt o inferencia","creación de sesión","autenticación o cambio de proveedor","credenciales persistentes","wake real o automático","commit","push","release"]}
