{
  "schema": "epistates/task-card/v1",
  "task_id": "e4-delivery-lifecycle",
  "objective": "Definir el ciclo durable de entrega E4 para separar reserva, envío, finalización y fallo después de un acuse asíncrono, sin implementar ni activar wake.",
  "target": {
    "repository": "epistates",
    "base_sha": "0a02a20fe93e7fcaf21bb39910e118517bbc0bf0",
    "branch": "main",
    "worktree": "/Users/krisnova/www/aria/epistates"
  },
  "role": "documenter",
  "authority": {
    "grant_id": "maintainer-e4-delivery-lifecycle",
    "granted_by": "maintainer",
    "granted_actions": ["read", "edit", "run_checks"],
    "protected_operations_authorized": []
  },
  "allowed_paths": [
    "docs/architecture/0009-entrega-wake-asincrona.md",
    "docs/architecture/README.md",
    "docs/plans/2026-08-28-e4-reactivation-design.md",
    "docs/plans/2026-08-28-e4-delivery-lifecycle.task-card.json",
    "docs/threat-model-e4-reactivation.md",
    "docs/adversarial-e4-delivery-lifecycle.md"
  ],
  "allowed_actions": ["read", "edit", "run_checks"],
  "forbidden_operations": [
    "commit",
    "push",
    "open_pr",
    "merge",
    "release",
    "install_dependencies",
    "change_scope",
    "git_reset",
    "create_branch",
    "delete_branch",
    "create_worktree",
    "remove_worktree"
  ],
  "inputs": [
    "docs/architecture/0007-reactivacion-soportada.md",
    "docs/architecture/0008-opencode-wake-port.md",
    "docs/adversarial-e4-opencode-terminal-response.md",
    "src/epistates/wake_guard.py",
    "src/epistates/opencode_wake.py"
  ],
  "checks": [
    {"check_id": "git_status", "expected": "exit 0; sólo los seis artefactos autorizados"},
    {"check_id": "diff_check", "expected": "exit 0"},
    {"check_id": "unit_tests", "expected": "exit 0"}
  ],
  "evidence": {
    "report_format": "rag/v1",
    "required": ["worktree_status", "diff_check", "check_results"]
  },
  "delivery": "ADR, plan, threat model y ronda adversarial que definan reserved/submitting/submitted/completed/failed/ambiguous, transiciones monotónicas, reconciliación y crash recovery. No código, red, credenciales, prompts, sesiones, wake ni automatización.",
  "stop_condition": "Detenerse ante necesidad de cambiar schemas públicos, implementar almacenamiento o transporte, llamar OpenCode/Z.ai, definir retry automático, liberar nonce/cuota después de un fallo ambiguo o presentar submitted como completed.",
  "new_decision_required_for": [
    "implementación del ledger de entrega",
    "integración con WakeGuardStore",
    "reconciliador runtime",
    "retry automático",
    "wake real o automático",
    "cambio de API pública",
    "release"
  ]
}
