{"schema":"epistates/task-card/v1","task_id":"e3b-inbox-reader","objective":"Implementar reconciliación acotada de bandeja local sin watcher ni wake.","target":{"repository":"epistates","base_sha":"97de7f3bd0ea2df16706a33246bd0edb7bc23c12","branch":"main","worktree":"/Users/krisnova/www/aria/epistates"},"role":"developer","authority":{"grant_id":"maintainer-e3b-inbox-reader","granted_by":"maintainer","granted_actions":["read","edit","run_checks"],"protected_operations_authorized":[]},"allowed_paths":["src/epistates/signal_inbox.py","tests/test_signal_inbox.py","docs/plans/2026-08-28-e3b-inbox.task-card.json"],"allowed_actions":["read","edit","run_checks"],"forbidden_operations":["commit","push","open_pr","merge","release","install_dependencies","change_scope","git_reset","create_branch","delete_branch","create_worktree","remove_worktree"],"inputs":["docs/architecture/0005-fuente-local-de-senales.md","src/epistates/signal_receipts.py"],"checks":[{"check_id":"diff_check","expected":"exit 0"},{"check_id":"unit_tests","expected":"exit 0"}],"evidence":{"report_format":"rag/v1","required":["worktree_status","diff_check","check_results"]},"delivery":"Lector acotado y pruebas; detenerse sin watcher o wake.","stop_condition":"Detenerse ante eventos de sistema, wake, red, tmux o reactivación.","new_decision_required_for":["watcher","wake","red o credenciales","operaciones Git protegidas"]}
