{
  "schema": "epistates/task-card/v1",
  "task_id": "e4-opencode-agent-preflight",
  "objective": "Verificar mediante GET /agent la configuración efectiva del agente epistates-inspect en OpenCode 1.18.25 y fallar cerrado ante permisos allow/ask, sin sesión, prompt, inferencia, wake ni endpoint adicional a health/agent.",
  "target": {
    "repository": "epistates",
    "base_sha": "864cb796f34007f282712129dc38407b0e4b0b4e",
    "branch": "main",
    "worktree": "/Users/krisnova/www/aria/epistates"
  },
  "role": "qa",
  "authority": {
    "grant_id": "maintainer-e4-opencode-agent-preflight",
    "granted_by": "maintainer",
    "granted_actions": ["read", "edit", "run_checks"],
    "protected_operations_authorized": []
  },
  "allowed_paths": [
    "docs/plans/2026-08-28-e4-reactivation-design.md",
    "docs/plans/2026-08-28-e4-opencode-agent-preflight.task-card.json",
    "docs/adversarial-e4-opencode-agent-preflight.md"
  ],
  "allowed_actions": ["read", "edit", "run_checks"],
  "forbidden_operations": [
    "commit",
    "push",
    "open_pr",
    "merge",
    "release",
    "install_dependencies",
    "change_scope",
    "git_reset",
    "create_branch",
    "delete_branch",
    "create_worktree",
    "remove_worktree"
  ],
  "inputs": [
    "opencode.json",
    "src/epistates/opencode_http.py",
    "src/epistates/opencode_wake.py",
    "docs/adversarial-e4-opencode-health-preflight.md",
    "OpenCode 1.18.25 local executable"
  ],
  "checks": [
    {"check_id": "git_status", "expected": "exit 0; sólo las tres rutas documentales E4-M"},
    {"check_id": "unit_tests", "expected": "exit 0"},
    {"check_id": "diff_check", "expected": "exit 0"}
  ],
  "evidence": {
    "report_format": "rag/v1",
    "required": ["worktree_status", "diff_check", "check_results"]
  },
  "delivery": "Evidencia saneada de GET /global/health y GET /agent mediante OpenCodeSubmissionTransport contra un servidor efímero 1.18.25 en 127.0.0.1. Reporta sólo unicidad, nombre, modo, modelo y resumen de acciones efectivas; nunca prompts, secretos ni payload completo.",
  "stop_condition": "Detenerse ante listener no numérico 127.0.0.1, versión distinta, ausencia o duplicación de epistates-inspect, modo/modelo inesperado, permiso efectivo allow/ask, endpoint fuera de health/agent, método distinto de GET, tercer request, sesión, prompt, inferencia, wake, credencial persistida o cambio de código/configuración.",
  "new_decision_required_for": [
    "corregir opencode.json o permisos heredados",
    "GET /provider o cualquier endpoint adicional",
    "sesión o prompt real",
    "inferencia o wake",
    "wiring runtime o polling",
    "credenciales persistentes",
    "cambio de código o API pública",
    "release",
    "commit",
    "push"
  ]
}
