{"schema":"epistates/task-card/v1","task_id":"e4-wake-guard","objective":"Implementar el guard persistente e inerte de E4 para policy, kill switch, nonce y cuota, sin proveedor, red ni wake real.","target":{"repository":"epistates","base_sha":"2f18a41fd19e00eac579ca0363b0288e8a5e9aad","branch":"main","worktree":"/Users/krisnova/www/aria/epistates"},"role":"developer","authority":{"grant_id":"maintainer-e4-wake-guard","granted_by":"maintainer","granted_actions":["read","edit","run_checks"],"protected_operations_authorized":[]},"allowed_paths":["src/epistates/wake_guard.py","tests/test_wake_guard.py","docs/plans/2026-08-28-e4-reactivation-design.md","docs/plans/2026-08-28-e4-wake-guard.task-card.json","docs/adversarial-e4-wake-guard.md"],"allowed_actions":["read","edit","run_checks"],"forbidden_operations":["commit","push","open_pr","merge","release","install_dependencies","change_scope","git_reset","create_branch","delete_branch","create_worktree","remove_worktree"],"inputs":["docs/architecture/0007-reactivacion-soportada.md","docs/threat-model-e4-reactivation.md","src/epistates/signal_receipts.py"],"checks":[{"check_id":"diff_check","expected":"exit 0"},{"check_id":"unit_tests","expected":"exit 0"}],"evidence":{"report_format":"rag/v1","required":["worktree_status","diff_check","check_results"]},"delivery":"Guard SQLite, pruebas adversariales, dictamen y tarjeta válida; detenerse sin adaptador, API pública concreta, red, credenciales o wake.","stop_condition":"Detenerse ante necesidad de invocar proveedor, verificar capabilities externas, enviar wake, almacenar secretos o modificar contratos publicados.","new_decision_required_for":["adaptador de proveedor","wake real","red o credenciales","API pública concreta","reactivación automática","release"]}
